{
  "$schema": "https://json-schema.org/draft/2020-12/schema",
  "$comment": "Generated by scripts/export_api_schemas.py from apps/api/schemas.py: do not edit",
  "$defs": {
    "Lever": {
      "additionalProperties": false,
      "allOf": [
        {
          "if": {
            "properties": {
              "id": {
                "const": "return_window_days"
              }
            },
            "required": [
              "id"
            ]
          },
          "then": {
            "properties": {
              "value": {
                "minimum": 14,
                "type": "integer"
              },
              "scope": {
                "const": "future_orders"
              }
            }
          }
        },
        {
          "if": {
            "properties": {
              "id": {
                "const": "free_return_shipping"
              }
            },
            "required": [
              "id"
            ]
          },
          "then": {
            "properties": {
              "value": {
                "type": "boolean"
              },
              "scope": {
                "const": "future_orders"
              }
            }
          }
        },
        {
          "if": {
            "properties": {
              "id": {
                "const": "instant_refund"
              }
            },
            "required": [
              "id"
            ]
          },
          "then": {
            "properties": {
              "value": {
                "type": "boolean"
              },
              "scope": {
                "const": "future_orders"
              }
            }
          }
        },
        {
          "if": {
            "properties": {
              "id": {
                "const": "free_size_exchange"
              }
            },
            "required": [
              "id"
            ]
          },
          "then": {
            "properties": {
              "value": {
                "type": "boolean"
              },
              "scope": {
                "const": "all_orders"
              }
            }
          }
        },
        {
          "if": {
            "properties": {
              "id": {
                "const": "coupons_enabled"
              }
            },
            "required": [
              "id"
            ]
          },
          "then": {
            "properties": {
              "value": {
                "type": "boolean"
              },
              "scope": {
                "const": "future_orders"
              }
            }
          }
        },
        {
          "if": {
            "properties": {
              "id": {
                "const": "cluster_coupons_disabled"
              }
            },
            "required": [
              "id"
            ]
          },
          "then": {
            "properties": {
              "value": {
                "type": "boolean"
              },
              "scope": {
                "const": "future_orders_cluster"
              }
            }
          }
        },
        {
          "if": {
            "properties": {
              "id": {
                "const": "transparency_notice"
              }
            },
            "required": [
              "id"
            ]
          },
          "then": {
            "properties": {
              "value": {
                "type": "boolean"
              },
              "scope": {
                "const": "communication"
              }
            }
          }
        },
        {
          "if": {
            "properties": {
              "id": {
                "const": "size_advice"
              }
            },
            "required": [
              "id"
            ]
          },
          "then": {
            "properties": {
              "value": {
                "type": "boolean"
              },
              "scope": {
                "const": "current_order"
              }
            }
          }
        },
        {
          "if": {
            "properties": {
              "id": {
                "const": "priority_size_exchange"
              }
            },
            "required": [
              "id"
            ]
          },
          "then": {
            "properties": {
              "value": {
                "type": "boolean"
              },
              "scope": {
                "const": "all_orders"
              }
            }
          }
        }
      ],
      "properties": {
        "id": {
          "enum": [
            "return_window_days",
            "free_return_shipping",
            "instant_refund",
            "free_size_exchange",
            "coupons_enabled",
            "cluster_coupons_disabled",
            "transparency_notice",
            "size_advice",
            "priority_size_exchange"
          ]
        },
        "value": {
          "type": [
            "integer",
            "boolean"
          ]
        },
        "scope": {
          "enum": [
            "future_orders",
            "future_orders_cluster",
            "all_orders",
            "current_order",
            "communication"
          ]
        }
      },
      "required": [
        "id",
        "value",
        "scope"
      ],
      "type": "object"
    },
    "MessageChoice": {
      "additionalProperties": false,
      "description": "The customer message to send: its language, and optionally the operator's edit of the\nconnective text (placeholders only; the API fills the fields and appends the legal clause).",
      "properties": {
        "lang": {
          "enum": [
            "it",
            "en"
          ],
          "title": "Lang",
          "type": "string"
        },
        "text": {
          "anyOf": [
            {
              "maxLength": 900,
              "minLength": 1,
              "type": "string"
            },
            {
              "type": "null"
            }
          ],
          "default": null,
          "title": "Text"
        }
      },
      "required": [
        "lang"
      ],
      "title": "MessageChoice",
      "type": "object"
    }
  },
  "additionalProperties": false,
  "allOf": [
    {
      "else": {
        "properties": {
          "override_reason": {
            "type": "null"
          },
          "override_category": {
            "type": "null"
          }
        }
      },
      "if": {
        "properties": {
          "action": {
            "enum": [
              "override",
              "reject",
              "lift"
            ]
          }
        },
        "required": [
          "action"
        ]
      },
      "then": {
        "properties": {
          "override_reason": {
            "type": "string"
          },
          "override_category": {
            "type": "string"
          }
        },
        "required": [
          "override_reason",
          "override_category"
        ]
      }
    },
    {
      "if": {
        "properties": {
          "action": {
            "enum": [
              "override"
            ]
          }
        },
        "required": [
          "action"
        ]
      },
      "then": {
        "properties": {
          "levers": {
            "type": "array"
          }
        },
        "required": [
          "levers"
        ]
      }
    },
    {
      "if": {
        "properties": {
          "action": {
            "enum": [
              "reject",
              "lift"
            ]
          }
        },
        "required": [
          "action"
        ]
      },
      "then": {
        "properties": {
          "levers": {
            "type": "null"
          }
        }
      }
    }
  ],
  "description": "POST /api/returns/{return_id}/decision (spec 19.B, plus decision_id and the category).\n\napprove: confirm the proposal (levers, if sent, must equal it: 409 otherwise); override:\nreplace the levers, with a reason and a category, checked by the legal guard (422); reject:\ndiscard the proposal (no lever applies, the order's terms stay; the return itself is never\nrefused), with a reason and a category. The three act on a proposed version.\n\nlift (US-607): end an approved or overridden restriction, before or at its review date (a\nreview, or a rectification the customer asked for), with a reason and a category. It creates\nthe next version (trigger review), overridden to the standard levers; 409 if the version\nnamed is not a restriction. Every action sends one message to the outbox.",
  "properties": {
    "decision_id": {
      "maxLength": 96,
      "minLength": 1,
      "pattern": "^[A-Za-z0-9][A-Za-z0-9._:~-]*$",
      "title": "Decision Id",
      "type": "string"
    },
    "action": {
      "enum": [
        "approve",
        "override",
        "reject",
        "lift"
      ],
      "title": "Action",
      "type": "string"
    },
    "levers": {
      "anyOf": [
        {
          "items": {
            "$ref": "#/$defs/Lever"
          },
          "type": "array"
        },
        {
          "type": "null"
        }
      ],
      "default": null,
      "title": "Levers"
    },
    "message": {
      "$ref": "#/$defs/MessageChoice"
    },
    "override_reason": {
      "anyOf": [
        {
          "maxLength": 1000,
          "minLength": 3,
          "pattern": "\\S[\\s\\S]+\\S",
          "type": "string"
        },
        {
          "type": "null"
        }
      ],
      "default": null,
      "title": "Override Reason"
    },
    "override_category": {
      "anyOf": [
        {
          "enum": [
            "evidence_disagreement",
            "customer_context",
            "linked_accounts_explained",
            "policy_exception",
            "periodic_review",
            "other"
          ],
          "type": "string"
        },
        {
          "type": "null"
        }
      ],
      "default": null,
      "title": "Override Category"
    },
    "approver": {
      "not": {
        "const": "system"
      },
      "pattern": "^[a-z][a-z0-9._-]{1,31}$",
      "title": "Approver",
      "type": "string"
    }
  },
  "required": [
    "decision_id",
    "action",
    "message",
    "approver"
  ],
  "title": "DecisionRequest",
  "type": "object"
}
